{
  "schemaVersion": 1,
  "scheduledDateUtc": "2026-09-09",
  "scheduledTimeUtc": "09:17",
  "run": {
    "conclusion": "success",
    "createdAt": "2026-09-09T09:28:08Z",
    "event": "schedule",
    "headSha": "0fb8df40126ea166f95016963c465b03db22819e",
    "jobs": [
      {
        "completedAt": "2026-09-09T09:36:01Z",
        "conclusion": "success",
        "databaseId": 102411789848,
        "name": "Coverage-guided fuzzing with per-target evidence",
        "startedAt": "2026-09-09T09:28:13Z",
        "status": "completed",
        "steps": [
          {
            "completedAt": "2026-09-09T09:28:15Z",
            "conclusion": "success",
            "name": "Set up job",
            "number": 1,
            "startedAt": "2026-09-09T09:28:14Z",
            "status": "completed"
          },
          {
            "completedAt": "2026-09-09T09:28:21Z",
            "conclusion": "success",
            "name": "Run actions/checkout@v6",
            "number": 2,
            "startedAt": "2026-09-09T09:28:15Z",
            "status": "completed"
          },
          {
            "completedAt": "2026-09-09T09:28:26Z",
            "conclusion": "success",
            "name": "Run jdx/mise-action@v4",
            "number": 3,
            "startedAt": "2026-09-09T09:28:21Z",
            "status": "completed"
          },
          {
            "completedAt": "2026-09-09T09:28:26Z",
            "conclusion": "success",
            "name": "Run ./.github/actions/setup-zig",
            "number": 4,
            "startedAt": "2026-09-09T09:28:26Z",
            "status": "completed"
          },
          {
            "completedAt": "2026-09-09T09:28:33Z",
            "conclusion": "success",
            "name": "Prove evidence rejects missing activity and oracle failures",
            "number": 5,
            "startedAt": "2026-09-09T09:28:26Z",
            "status": "completed"
          },
          {
            "completedAt": "2026-09-09T09:35:57Z",
            "conclusion": "success",
            "name": "Fuzz each target with a measured activity floor",
            "number": 6,
            "startedAt": "2026-09-09T09:28:33Z",
            "status": "completed"
          },
          {
            "completedAt": "2026-09-09T09:35:58Z",
            "conclusion": "success",
            "name": "Preserve fuzz receipts, reports, and replay corpus",
            "number": 7,
            "startedAt": "2026-09-09T09:35:57Z",
            "status": "completed"
          },
          {
            "completedAt": "2026-09-09T09:35:59Z",
            "conclusion": "success",
            "name": "Post Run actions/checkout@v6",
            "number": 14,
            "startedAt": "2026-09-09T09:35:58Z",
            "status": "completed"
          },
          {
            "completedAt": "2026-09-09T09:35:59Z",
            "conclusion": "success",
            "name": "Complete job",
            "number": 15,
            "startedAt": "2026-09-09T09:35:59Z",
            "status": "completed"
          }
        ],
        "url": "https://github.com/nullstyle/capnp-zig/actions/runs/34334866428/job/102411789848"
      },
      {
        "completedAt": "2026-09-09T09:37:24Z",
        "conclusion": "success",
        "databaseId": 102411790116,
        "name": "RPC soak (chaos + deadlines, windows-latest)",
        "startedAt": "2026-09-09T09:28:12Z",
        "status": "completed",
        "steps": [
          {
            "completedAt": "2026-09-09T09:28:17Z",
            "conclusion": "success",
            "name": "Set up job",
            "number": 1,
            "startedAt": "2026-09-09T09:28:13Z",
            "status": "completed"
          },
          {
            "completedAt": "2026-09-09T09:28:35Z",
            "conclusion": "success",
            "name": "Run actions/checkout@v6",
            "number": 2,
            "startedAt": "2026-09-09T09:28:17Z",
            "status": "completed"
          },
          {
            "completedAt": "2026-09-09T09:31:24Z",
            "conclusion": "success",
            "name": "Run jdx/mise-action@v4",
            "number": 3,
            "startedAt": "2026-09-09T09:28:35Z",
            "status": "completed"
          },
          {
            "completedAt": "2026-09-09T09:31:28Z",
            "conclusion": "success",
            "name": "Run ./.github/actions/setup-zig",
            "number": 4,
            "startedAt": "2026-09-09T09:31:24Z",
            "status": "completed"
          },
          {
            "completedAt": "2026-09-09T09:35:20Z",
            "conclusion": "success",
            "name": "Run soak harness (2 minutes, 8 workers)",
            "number": 5,
            "startedAt": "2026-09-09T09:31:28Z",
            "status": "completed"
          },
          {
            "completedAt": "2026-09-09T09:36:56Z",
            "conclusion": "success",
            "name": "Run soak harness under ReleaseSafe (1 minute)",
            "number": 6,
            "startedAt": "2026-09-09T09:35:20Z",
            "status": "completed"
          },
          {
            "completedAt": "2026-09-09T09:37:18Z",
            "conclusion": "success",
            "name": "Run soak harness under ReleaseSafe (64 workers)",
            "number": 7,
            "startedAt": "2026-09-09T09:36:56Z",
            "status": "completed"
          },
          {
            "completedAt": "2026-09-09T09:37:18Z",
            "conclusion": "skipped",
            "name": "Run soak harness under ThreadSanitizer (30 seconds)",
            "number": 8,
            "startedAt": "2026-09-09T09:37:18Z",
            "status": "completed"
          },
          {
            "completedAt": "2026-09-09T09:37:22Z",
            "conclusion": "success",
            "name": "Post Run actions/checkout@v6",
            "number": 16,
            "startedAt": "2026-09-09T09:37:18Z",
            "status": "completed"
          },
          {
            "completedAt": "2026-09-09T09:37:22Z",
            "conclusion": "success",
            "name": "Complete job",
            "number": 17,
            "startedAt": "2026-09-09T09:37:22Z",
            "status": "completed"
          }
        ],
        "url": "https://github.com/nullstyle/capnp-zig/actions/runs/34334866428/job/102411790116"
      },
      {
        "completedAt": "2026-09-09T09:40:25Z",
        "conclusion": "success",
        "databaseId": 102411790170,
        "name": "Extended gates",
        "startedAt": "2026-09-09T09:28:12Z",
        "status": "completed",
        "steps": [
          {
            "completedAt": "2026-09-09T09:28:14Z",
            "conclusion": "success",
            "name": "Set up job",
            "number": 1,
            "startedAt": "2026-09-09T09:28:12Z",
            "status": "completed"
          },
          {
            "completedAt": "2026-09-09T09:28:22Z",
            "conclusion": "success",
            "name": "Run actions/checkout@v6",
            "number": 2,
            "startedAt": "2026-09-09T09:28:14Z",
            "status": "completed"
          },
          {
            "completedAt": "2026-09-09T09:28:28Z",
            "conclusion": "success",
            "name": "Run jdx/mise-action@v4",
            "number": 3,
            "startedAt": "2026-09-09T09:28:22Z",
            "status": "completed"
          },
          {
            "completedAt": "2026-09-09T09:28:28Z",
            "conclusion": "success",
            "name": "Run ./.github/actions/setup-zig",
            "number": 4,
            "startedAt": "2026-09-09T09:28:28Z",
            "status": "completed"
          },
          {
            "completedAt": "2026-09-09T09:29:39Z",
            "conclusion": "success",
            "name": "Run ./.github/actions/setup-capnp",
            "number": 5,
            "startedAt": "2026-09-09T09:28:28Z",
            "status": "completed"
          },
          {
            "completedAt": "2026-09-09T09:29:41Z",
            "conclusion": "success",
            "name": "Restore Zig package cache",
            "number": 6,
            "startedAt": "2026-09-09T09:29:39Z",
            "status": "completed"
          },
          {
            "completedAt": "2026-09-09T09:31:03Z",
            "conclusion": "success",
            "name": "Prefetch dependency tree",
            "number": 7,
            "startedAt": "2026-09-09T09:29:41Z",
            "status": "completed"
          },
          {
            "completedAt": "2026-09-09T09:32:41Z",
            "conclusion": "success",
            "name": "Full test suite",
            "number": 8,
            "startedAt": "2026-09-09T09:31:03Z",
            "status": "completed"
          },
          {
            "completedAt": "2026-09-09T09:36:14Z",
            "conclusion": "success",
            "name": "QUIC self-healing soak (abrupt deaths + healing workers)",
            "number": 9,
            "startedAt": "2026-09-09T09:32:41Z",
            "status": "completed"
          },
          {
            "completedAt": "2026-09-09T09:40:08Z",
            "conclusion": "success",
            "name": "ReleaseSafe hardening tests",
            "number": 10,
            "startedAt": "2026-09-09T09:36:14Z",
            "status": "completed"
          },
          {
            "completedAt": "2026-09-09T09:40:22Z",
            "conclusion": "success",
            "name": "QUIC transport tests",
            "number": 11,
            "startedAt": "2026-09-09T09:40:08Z",
            "status": "completed"
          },
          {
            "completedAt": "2026-09-09T09:40:22Z",
            "conclusion": "success",
            "name": "Post Restore Zig package cache",
            "number": 21,
            "startedAt": "2026-09-09T09:40:22Z",
            "status": "completed"
          },
          {
            "completedAt": "2026-09-09T09:40:22Z",
            "conclusion": "success",
            "name": "Post Run actions/checkout@v6",